{
  "$schema": "https://json-schema.org/draft/2020-12/schema",
  "$id": "https://provability-fabric.org/schemas/evidence/v0.1/proof.schema.json",
  "title": "EvidenceProofV01",
  "type": "object",
  "additionalProperties": false,
  "required": ["schema_version", "proof_id", "proof_system", "artifact_refs", "proof_digest"],
  "properties": {
    "schema_version": { "const": "0.1" },
    "proof_id": { "type": "string", "minLength": 1 },
    "proof_system": { "type": "string", "minLength": 1 },
    "artifact_refs": {
      "type": "array",
      "minItems": 1,
      "items": { "$ref": "#/$defs/artifact_ref" }
    },
    "proof_digest": {
      "type": "string",
      "pattern": "^sha256:[0-9a-f]{64}$"
    }
  },
  "$defs": {
    "artifact_ref": {
      "type": "object",
      "additionalProperties": false,
      "required": ["role", "path", "media_type", "digest"],
      "properties": {
        "role": { "type": "string", "minLength": 1 },
        "path": { "type": "string", "minLength": 1 },
        "media_type": { "type": "string", "minLength": 1 },
        "digest": {
          "type": "string",
          "pattern": "^sha256:[0-9a-f]{64}$"
        }
      }
    }
  }
}
